{
  "node_id": "pack_audit_and_publish",
  "stage": 7,
  "input": {
    "provenance": {
      "source_url": "https://github.com/nichochar/tech-seo-tool",
      "commit_sha": "a1b2c3d4e5f6a1b2c3d4e5f6a1b2c3d4e5f6a1b2",
      "fetched_at": "2026-02-15T10:30:00Z",
      "author": "nichochar",
      "license_spdx": "MIT"
    },
    "gate_decision": {
      "schema_version": "0.1.0",
      "gate_id": "gate-550e8400-e29b-41d4-a716-446655440000",
      "node_id": "constitution_risk_gate",
      "job_id": "550e8400-e29b-41d4-a716-446655440000",
      "decision": "ALLOW",
      "risk_tier": "L1",
      "decided_at": "2026-02-15T10:45:00Z",
      "expires_at": "2026-02-15T11:45:00Z"
    },
    "test_report": {
      "total_runs": 3,
      "passed": 3,
      "failed": 0,
      "success_rate": 1.0,
      "avg_latency_ms": 1250.5,
      "total_cost_usd": 0.0025
    },
    "trace_path": "/skills/tech_seo_audit/550e8400-e29b-41d4-a716-446655440000/run_trace.jsonl",
    "visibility": "public"
  },
  "output": {
    "audit_pack_path": "/registry/tech_seo_audit/1.0.0/audit_pack.zip",
    "publish_result": {
      "status": "published",
      "registry_url": "https://registry.gm-os.dev/skills/tech_seo_audit",
      "skill_id": "tech_seo_audit",
      "version": "1.0.0"
    }
  }
}
